instruction,input,output,text
Placing limit order and stop loss on same stock at same time,,"From your question, I am guessing that you are intending to have stoploss buy order. is the stoploss order is also a buy order ?  As you also said, you seems to limit your losses, I am again guessing that you have short position of the stock, to which you are intending to place a buy limit order and buy stoploss order (stoploss helps when when the price tanks). And also I sense that you intend to place buy limit order at the price below the market price. is that the situation?  If you place two independent orders (one limit buy and one stoploss buy). Please remember that there will be situation where two orders also get executed due to market movements. Add more details to the questions. it helps to understand the situation and others can provide a strategic solution.",
Why could rental costs for apartments/houses rise while buying prices can go up and down?,,"I am from Australia, so my answer is based on my experience over here, however it should be similar for the USA. Generally, what determines both the price of houses/apartments and the rents for them is supply and demand. When there is high demand and low supply prices (or rents) generally go up. When there is low demand and high supply prices (or rents) usually go down. What can sometimes happen when house prices go down, is that the demand can drop but so can supply. As the prices drop, developers will make less money on building new houses, so stop building new houses. Other developers can go bankrupt. As less people (including investors) are buying houses, and more people (including investors) try to sell their existing houses, there will be more people looking to rent and less rental properties available to rent. This produces a perfect storm of high demand and low supply of rental properties, causing rents to rise strongly. When the property prices start to go up again as demand increases, there is a shortfall of new properties being built (due to the developers not building during the downturn). At this time developers start to build again but there is a lag time before the new houses can be completed. This lack of supply puts more pressure on both house prices and rents to go up further. Until equilibrium between supply and demand is realised or an oversupply of rental properties exists in the market, rents will continue to rise.",
What do I need to do to form an LLC?,,"I know that there are a lot service on the internet helping to form an LLC online with a fee around $49. Is it neccessarry to pay them to have an LLC or I can do that myself? No, you can do it yourself. The $49 is for your convenience, but there's nothing they can do that you wouldn't be able to do on your own. What I need to know and what I need to do before forming an LLC? You need to know that LLC is a legal structure that is designed to provide legal protections. As such, it is prudent to talk to a legal adviser, i.e.: a Virginia-licensed attorney. Is it possible if I hire some employees who living in India? Is the salary for my employees a expense? Do I need to claim this expense? This, I guess, is entirely unrelated to your questions about LLC. Yes, it is possible. The salary you pay your employees is your expense. You need to claim it, otherwise you'd be inflating your earnings which in certain circumstances may constitute fraud. What I need to do to protect my company? For physical protection, you'd probably hire a security guard. If you're talking about legal protections, then again - talk to a lawyer. What can I do to reduce taxes? Vote for a politician that promises to reduce taxes. Most of them never deliver though. Otherwise you can do what everyone else is doing - tax planning. That is - plan ahead your expenses, time your invoices and utilize tax deferral programs etc. Talk to your tax adviser, who should be a EA or a CPA licensed in Virginia. What I need to know after forming an LLC? You'll need to learn what are the filing requirements in your State (annual reports, tax reports, business taxes, sales taxes, payroll taxes, etc). Most are the same for same proprietors and LLCs, so you probably will not be adding to much extra red-tape. Your attorney and tax adviser will help you with this, but you can also research yourself on the Virginia department of corporations/State department (whichever deals with LLCs).",
"What options do I have at 26 years old, with 1.2 million USD?",,"That's what I would do; 1.2 million dollars is a lot of money, but it doesn't make you retired for the rest of your life: There is a big crisis coming soon (my personal prediction) in the next 10-15 years, and when this happens: government will hold your money if you leave them in the bank (allowing you to use just part of it; you will have to prove the reason you need it), government will pass bills to make it very hard to close your investment positions, and government will pass new laws to create new taxes for people with a lot of money (you). To have SOME level of security I would separate my investment in the following: 20% I would buy gold certificates and the real thing (I would put the gold in a safe(s)). 20% I would put in bitcoin (you would have to really study this if you are new to crypto currency in order to be safe). 40% I would invest in regular finance products (bonds, stocks and options, FX). 20% I would keep in the bank for life expenses, specially if you don't want work for money any more. 20% I would invest in startup companies exchanging high risk hoping for a great return. Those percentages might change a little depending how good/confident you become after investing, knowing about business, etc...",
"In general, is it financially better to buy or to rent a house?",,"Which is generally the better option (financially)? Invest. If you can return 7-8% (less than the historical return of the S&P 500) on your money over the course of 25 years this will outperform purchasing personal property. If you WANT to own a house for other reason apart from the financial benefits then buy a house. Will you earn 7-8% on your money, there is a pretty good chance this is no because investors are prone to act emotionally.",
Are there index tracking funds that avoid the “buy high - sell low” problem?,,"There are some index funds out there like this - generally they are called ""equal weight"" funds.  For example, the Rydex S&P Equal-Weight ETF.  Rydex also has several other equal weight sector funds",
Cons of withdrawing money from an Roth IRA account?,,"One ""con"" I have not yet seen mentioned: retirement accounts are generally protected from creditors in a bankruptcy.  There are limits and exceptions, Roth has a 1.2 million dollar limit and can be split by a divorce QDRO for instance.  Link Since it seems you have no income this year, you may may be raiding your IRA for living expenses.   If there is a chance you may declare bankruptcy in the next year or so, consider doing that first and raid the IRA for seed money after.",
Is it necessary to pay tax if someone lends me money to put into my mortgage?,,"This answer is specifically for the UK, but one building society has an account set up specifically for this. You actually refer your friend/family member to set up an account and then it can be linked to your mortgage. They don't get any interest for their account as it's all offset against your mortgage. If you then happen to give them a cash gift (up to £250 or possibly £3000 per year, I can't work out which is the reliable number, as of 2015) then it's all completely above board.",
How to reconcile performance with dividends?,,"Just look at the published annualized returns, which are inclusive of distributions and fees. From the Vanguard website: Average annual returns include changes in share price and reinvestment of dividends and capital gains.",
"Should I be more aggressive in a Roth IRA, 401k, or taxable account?",,"I think you may be drawing the wrong conclusion about why you put what type of investment in a taxable vs. tax-advantaged account. It is not so much about risk, but type of return. If you're investing both tax-advantaged and taxable accounts, you can benefit by putting more tax-inefficient investments inside your tax-advantaged accounts. Some aggressive asset types, like real estate, can throw off a lot of taxable income. If your asset allocation calls for investing in real estate, holding it in a 401k or IRA can allow more of your money to remain invested, rather than having to use it to pay for taxes. And if you're holding in a Roth IRA, you get that tax free. But bonds, a decidedly non-aggressive asset, also throw off a lot of taxable income. You're able to hold them in a tax-advantaged account and not pay taxes on the income until you withdraw it from the account (or tax free in the case of a Roth account.) An aggressive stock fund that is primarily expected to provide returns via price appreciation would do well in a taxable account because there's likely little tax consequence to you until it is sold.",
Wash sales + restricted stock in US,,"grant date or vesting date?
A: For restricted stock, I think the vesting date meets the requirements of the second wash sale trigger from IRS Pub 550: Wash Sales: Acquire substantially identical stock or securities in a fully taxable trade I base this on these two quotes from IRS Pub 525: Restricted Property: any income from the property, or the right to use the property, is included in your income as additional compensation in the year you receive the income or have the right to use the property. - Until the property becomes substantially vested, it is owned by the person who makes the transfer to you, usually your employer.  So on the vest date: The transfer is taxable Ownership is transferred to you That seems close enough to ""a fully taxable trade"" for me.  Maybe this changes if you pay the tax on the stock on the grant date. See Pub 525: Restricted Property: Choosing to include in income for year of transfer. Obviously, if this is important you should consult your tax advisor.  Technicalities aside, I don't think it passes the sniff test. You're getting salable shares when the restricted stock vests. If you're selling other shares at a loss within 30 days of the vesting date, that smells like a wash sale to me.",
Simple and safe way to manage a lot of cash,,"If this money is intended to be used for retirement and depending on how old ""older"" is, it sounds a little risky to be putting too much money in a stock based mutual fund.  While the CDs may seem like crappy investments right now, it is important to down-shift risk as you get closer to retirement because this person won't have as much time to recover if the markets take another big dip.",
Personal Tax Return software for Linux?,,TurboTax online works via Firefox (i.e. it is a cloud-based service.) I don't think any downloaded software is available directly for Linux.,
How can I use debt management to improve my financial situation?,,Debt management plans address unsecured debts like credit cards and personal loans. Debt management usually happens through: \n1. DIY debt management\n2. Debt management with a credit counselor\n3. Debt relief company,
How much should a graduate student attempt to save?,,"First, don't save anything in a tax sheltered vehicle. You will be paying so little tax that there will be essentially no benefit to making the contributions, and you'll pay tax when they come out. Tax free compounding for 40 years is terrific, but start that after you're earning more than a stipend. Second, most people recommend having a month's expenses readily available for emergencies. For you, that would be $1500. If you put $100 a month aside, it will take over a year to have your emergency fund. It's easy to argue that you should pick a higher pace, so as to have your emergency money in place sooner. However, the ""emergencies"" usually cited are things like home repair, car repair, needing to replace your car, and so on. Since you are renting your home and don't have a car, these emergencies aren't going to happen to you. Ask yourself, if your home was destroyed, and you had to replace all your clothes and possessions (including furniture), how much would you need? (Keep in mind any insurance you have.) The only emergency expense I can't guess about is health costs, because I live in Canada. I would be tempted to tell you to get a credit card with a $2000 limit and consider that your emergency fund, just because grad student living is so tight to the bone (been there, and 25 years ago I had $1200 a month, so it must be harder for you now.) If you do manage to save up $1500, and you've really been pinching to do that (walking instead of taking the bus, staying on campus hungry instead of popping out to buy food) let up on yourself when you hit the target. Delaying your graduation by a few months because you're not mentally sharp due to hunger or tiredness will be a far bigger economic hit than not having saved $200 a month for 2 or 3 years. The former is 3-6 months of your new salary, the latter 5-7K. You know what you're likely to earn when you graduate, right?",
Do market shares exhaust?,,"As @ApplePie pointed out in their answer, at any given time there is a finite amount of stock available in a company. One subtlety you may be missing is that there is always a price associated with an offer to buy shares. That is, you don't put in an order simply to buy 1 share of ABC, you put in an order to buy 1 share of ABC for $10. If no one is willing to sell a share of ABC for $10, then your order will go unfilled. This happens millions of times a day as traders try to figure the cheapest price they can get for a stock. Practically speaking, there is always a price at which people are willing to sell their shares. You can put in a market order for 1 share of ABC, which says essentially ""I want one share of ABC, and I will pay whatever the market deems to be the price"". Your broker will find you 1 share, but you may be very unhappy about the price you have to pay! While it's very rare for a market to have nobody willing to sell at any price, it occasionally happens that no one is willing to buy at any price. This causes a market crash, as in the 2007-2008 financial crisis, when suddenly everyone became very suspicious of how much debt the major banks actually held, and for a few days, very few traders were willing to buy bank stocks at any price.",
Why do employer contributions count against HSA limits?,,"am I comparing apples and oranges? Yes - different purposes, different laws, different regulations.  One rationale could be that HSA benefits are immediate while retirement benefits are deferred, so the benefit of employer contributions are not felt until retirement and thus do not need as stringent a limit, but that's a complete guess.",
Can I rely on my home equity to finance large home repairs?,,"Yes, a HELOC is great for that. I just had my roof done last month (~$15K, ""ugh"") and pretty much every major contractor in my area had a 0% same-as-cash for at least 12 months. So that helps - any balance that I don't bank by 11/15/2015 will be on the HELOC.",
Impact of RMD on credit worthiness,,"The actual policy will vary based on the specific bank.  But, if I were in your shoes I'd include RMDs in my stated income for credit card purposes.",
Who should pay taxes in my typical case?,,"Once you turn 18 you should open an account in your own name and transfer the assets there. Currently your mom is the one responsible as far as the IRS cares with respect to taxes as it is her name on the account. The taxes due will be based on your mom's tax rate. As a good child you can reimburse your mom for the taxes that she has to on your behalf. Also legally that money currently belongs to her. Any legal judgement against your mom can claim that money and it is not available for using as an asset by you on credit applications and such. A better solution would have been for your mom to open a custodial account in your name. This way the money is still yours (you just don't have control of it until you turn 18). While probably not an issue here, the transferring of money between you and your mom (and then back) is considered a gift by the IRS. If the account was very well funded then you could run into having to deal with the annual gift limit and lifetime gift exclusion. Based on the clarification that the question is in reference to India: while I don't know the particulars of the law in India my advice of transferring the assets when you turn 18 still remains. The main difference that I would see been India and the US would be the gift tax / exclusions. Unless someone else knows otherwise I would still expect the law in India to see the current account as being the property of the mother.",
Does high inflation help or hurt companies with huge cash reserves?,,"This is a reasonable question about inflation.  I would just like to note that inflation is nearly zero at the moment.  And interest rates are very low.  For a stable enterprise, borrowing cash is very easy right now.  Naturally, things could change in a year.  But the reason a company like Microsoft (but not just them) might hoard cash right now is that it gives them weight for buying up smaller firms, muscling rivals, and signaling their comfort level with the way things look for them.  It could also be because they are out of ideas for what to invest in, and/or are waiting for conditions to change before making any big decisions.  But with an interest rate at close to zero, and an inflation rate at close to zero, at the moment, inflation is not going to be a consideration in evaluating such a company.",
"If I have $1000 to invest in penny stocks online, should I diversify risk and invest in many of them or should I invest in just in one?",,"There's a grey area where investing and speculating cross. For some, the stock market, as in 10% long term return with about 14% standard deviation, is too risky. For others, not enough action.  Say you have chosen 10 penny stocks, done your diligence, to the extent possible, and from a few dozen this is the 10 you like. I'd rather put $100 into each of 10 than to put all my eggs in one basket. You'll find that 3 might go up nicely, 3 will flounder around, and 4 will go under. The gambler mentality is if one takes off, you have a profit.  After the crash of '08, buying both GM and Ford at crazy prices actually worked, GM stockholders getting nothing, but Ford surviving and now 7X what I bought it for.  Remember, when you go to vegas, you don't drop all your chips on Red, you play blackjack/craps as long as you can, and get all the free drinks you can.",
Why is the fractional-reserve banking not a Ponzi scheme?,,"The fundamental underlying difference between a bank and a Ponzi scheme: When a bank lends money and charges interest, people can do things with that borrowed money which are worth it. (Building factories, starting businesses, or just enjoying the comfort and warmth of a single-family home instead of paying rent). This is why fractional-reserve banking is able to work. People may also do things which do not necessarily turn a financial profit (financing large purchases on a credit card) but are worth it in terms of an expenditure. They may also do stupid things (financing useless purchases on a credit card and wasting their money) or otherwise dispose of the money poorly (the new business fails, the home's value plummets, etc). A Ponzi scheme never really bothered to do useful things with the money. Social Security has been mentioned. Part of social security's setup involves the current population of workers paying the current population of retirees; their own retirements will have to be financed by the next generation. This design is not intrinsically a Ponzi scheme: both the population and the economy ought to remain growing for the intermediate future, so there will be at least as much money (and probably much more) for them to pay those bills. Unlike a Ponzi scheme, the idea that it will continue to attract new money to pay out existing claims is a realistic one. The real questions of its sustainability are a matter of specifics: is it collecting enough money to remain functional in the future, or is it outpacing the growth of the economy and the population?",
Is it possible for me to keep my credit card APR at 0% permanently?,,"Banks don't care that you are responsible cardholder. They care to make money. Interest rates are basically 0% by government policy and the banks charge their responsible cardholders 20% interest rates. Think about that for one second, and realize they really do not care about your ability to avoid paying interest, they only need you to 'slip up' one month during your entire lifetime to make a profit from you. It is in their interest for you to get into a spending habit, from 0% promo rates, so that eventually a frivolous purchase or life changing event causes a balance to stay on the card for over one month.",
Buying my first car out of college,,I've seen this approach to buying/funding cars described in a couple of different ways over the years. Random thoughts:,
Low risk withdrawal from market. Is there a converse to dollar-cost-averaging?,,"When you are a certain age you will be able to tap into your retirement accounts, or start receiving pension and social security funds. In addition you may be faced with required minimum distributions from these accounts.  But even before you get to those points you will generally shift the focus of new funds into the retirement account to be more conservative. Depending on the balances in the various accounts and the size of the pension and social security accounts you may even move invested funds from aggressive to conservative investments. The proper proportion of the many different types of investments and revenue streams is open to much debate. During retirement you will be pulling money out of retirement accounts either to support your standard of living or to meet the required minimum distributions. What to sell will be based on either the tax implications or the required distributions that will still maintain the asset allocation you desire.   If your distributions are driven by the law you will be selling enough to meet a specific required $ figure. You will either spend that money or move it into a low interest savings account or a non-retirement investment account. If trying to meet your standard of living expectations you will be selling funds that allow you to keep your desired asset allocation but still have enough to live on. Again you will be trying to meet a specific $ figure.  Of course you may decide at anytime in retirement to rebalance based on changes to your lifestyle, family obligations, or winning the lottery.",
Is stock in a private corporation taxable?,,"This stock is the same as any other, but you need to keep clear in your head that you and your company are now different entities.  You (the person) will pay tax on capital gains and losses when you sell any stock that you hold in your own name.  You'll also owe ""regular"" tax if you draw a salary, etc.  The fact that it may be ""your"" company does not change these things. The company will not recognize a gain by selling stock to raise capital since it's nominally exchanging things of equal value, say $100 in cash for $100 in stock.  In order to sell stock, however, you MIGHT need to register with the SEC depending on how you're going about finding your investors, so keep that in mind.",
